employer,department,employee_id,ssn
"Carroll, Konopelski and Wunsch",Research and Development,43-4797129,166-10-4488
"Carroll, Konopelski and Wunsch",Research and Development,43-4797129,166-10-4488
"Bernier, Ruecker and Carroll",Services,69-0108218,222-39-8571
Carroll and Sons,Marketing,96-0367474,243-44-4611
"Carroll, Treutel and Kub",Research and Development,83-9766179,262-09-2144
"Carroll, Skiles and McDermott",Engineering,59-4324075,718-91-6110
Carroll-Tillman,Services,91-7097850,765-35-8117
"Gulgowski, Carroll and Sauer",Training,27-6046833,781-88-2076
